<?xml version="1.0" encoding="UTF-8"?>
<metereologia xmlns:xsi="http://www.w3.org/2001/XMLSchema-instance"
xsi:noNamespaceSchemaLocation="MetereologiaXSD.xsd">
	<comunidades>
        <comunidaAutonoma nombre="Leon">
            <provincias>
                <provincia nombre="Madrids">
                    <poblaciones>
                        <poblacion nombre="Madrid">
                            <fecha>2022-12-05</fecha>
                            <temperatura-maxima>ww</temperatura-maxima>
                            <temperatura-minima>ww</temperatura-minima>
                            <probabilidadlluvia>ww</probabilidadlluvia>
                            <avisos>
                                <aviso>Viento</aviso>
                                <aviso>Tormenta</aviso>
                            </avisos>
                        </poblacion>
                    </poblaciones>       
                </provincia>
    
            </provincias>
        </comunidaAutonoma>
        
    </comunidades>
   
					
</metereologia>